{
  "$schema": "https://json-schema.org/draft/2020-12/schema",
  "$id": "https://oridesign.local/schemas/m0f/neg-path-polynomial-degree-range-candidate-bundle-ledger-v1.schema.json",
  "title": "NEG-PATH-MUTATION-POLYNOMIAL-DEGREE-OUT-OF-RANGE exact-negative candidate bundle ledger v1",
  "type": "object",
  "additionalProperties": false,
  "required": [
    "schemaVersion",
    "schemaId",
    "recordType",
    "contractStatus",
    "scientificClaim",
    "vectorSetId",
    "scope",
    "declaredPiecewisePolynomialZeroDegreeRejectionParserOnly",
    "fractionalDegreeRejectionVectorIncluded",
    "unsafeIntegerDegreeRejectionVectorIncluded",
    "generalPositiveSafeIntegerDegreeDomainEstablished",
    "declaredPiecewisePolynomialCoefficientDegreeCardinalityParserOnly",
    "pathTimeCoverageEstablished",
    "canonicalManifestPath",
    "canonicalManifestRegistration",
    "canonicalPromotionClaimed",
    "canonicalPathMutationFamilyComplete",
    "representationSelectionEstablished",
    "piecewisePolynomialBasisFrozen",
    "polynomialCoefficientOrderingEstablished",
    "polynomialCoefficientSemanticsEstablished",
    "polynomialCoefficientIntervalAssociationEstablished",
    "polynomialDerivativeSemanticsEstablished",
    "polynomialDerivativeValidationIncluded",
    "piecewisePolynomialEndpointInferenceIncluded",
    "pathRepresentationCompletenessEstablished",
    "motionMapCompletenessEstablished",
    "creaseMapCompletenessEstablished",
    "physicalAngleScheduleEstablished",
    "radianConventionEstablished",
    "physicalAngleBoundsEstablished",
    "conservativeDerivativeBoundsEstablished",
    "kinematicFeasibilityEstablished",
    "physicalPathContinuityEstablished",
    "endpointContinuityEstablished",
    "rigidityEstablished",
    "faceIsometryEstablished",
    "hingeGeometryEstablished",
    "certificateHashVerificationIncluded",
    "cryptographicAuthenticityEstablished",
    "contactAnalysisIncluded",
    "continuousCollisionDetectionIncluded",
    "collisionDetectionIncluded",
    "collisionFreedomEstablished",
    "foldabilityEstablished",
    "supportProfileIncluded",
    "toleranceProfileIncluded",
    "scientificVerificationClaimed",
    "globalM0fGate",
    "caseCount",
    "artifactCount",
    "generator",
    "provenance",
    "cases",
    "artifacts"
  ],
  "properties": {
    "schemaVersion": { "const": 1 },
    "schemaId": {
      "const": "https://oridesign.local/schemas/m0f/neg-path-polynomial-degree-range-candidate-bundle-ledger-v1.schema.json"
    },
    "recordType": { "const": "m0f-neg-path-polynomial-degree-range-candidate-bundle-ledger" },
    "contractStatus": { "const": "candidate" },
    "scientificClaim": { "const": false },
    "vectorSetId": { "const": "NEG-PATH-MUTATION-POLYNOMIAL-DEGREE-OUT-OF-RANGE-V1" },
    "scope": {
      "const": "project-authored-exact-negative-artifact-contract-piecewise-polynomial-zero-degree-rejection-parser-replay-only"
    },
    "declaredPiecewisePolynomialZeroDegreeRejectionParserOnly": { "const": true },
    "fractionalDegreeRejectionVectorIncluded": { "const": false },
    "unsafeIntegerDegreeRejectionVectorIncluded": { "const": false },
    "generalPositiveSafeIntegerDegreeDomainEstablished": { "const": false },
    "declaredPiecewisePolynomialCoefficientDegreeCardinalityParserOnly": { "const": false },
    "pathTimeCoverageEstablished": { "const": false },
    "canonicalManifestPath": { "const": "tests/fixtures/manifest.json" },
    "canonicalManifestRegistration": { "const": "not-registered" },
    "canonicalPromotionClaimed": { "const": false },
    "canonicalPathMutationFamilyComplete": { "const": false },
    "representationSelectionEstablished": { "const": false },
    "piecewisePolynomialBasisFrozen": { "const": false },
    "polynomialCoefficientOrderingEstablished": { "const": false },
    "polynomialCoefficientSemanticsEstablished": { "const": false },
    "polynomialCoefficientIntervalAssociationEstablished": { "const": false },
    "polynomialDerivativeSemanticsEstablished": { "const": false },
    "polynomialDerivativeValidationIncluded": { "const": false },
    "piecewisePolynomialEndpointInferenceIncluded": { "const": false },
    "pathRepresentationCompletenessEstablished": { "const": false },
    "motionMapCompletenessEstablished": { "const": false },
    "creaseMapCompletenessEstablished": { "const": false },
    "physicalAngleScheduleEstablished": { "const": false },
    "radianConventionEstablished": { "const": false },
    "physicalAngleBoundsEstablished": { "const": false },
    "conservativeDerivativeBoundsEstablished": { "const": false },
    "kinematicFeasibilityEstablished": { "const": false },
    "physicalPathContinuityEstablished": { "const": false },
    "endpointContinuityEstablished": { "const": false },
    "rigidityEstablished": { "const": false },
    "faceIsometryEstablished": { "const": false },
    "hingeGeometryEstablished": { "const": false },
    "certificateHashVerificationIncluded": { "const": false },
    "cryptographicAuthenticityEstablished": { "const": false },
    "contactAnalysisIncluded": { "const": false },
    "continuousCollisionDetectionIncluded": { "const": false },
    "collisionDetectionIncluded": { "const": false },
    "collisionFreedomEstablished": { "const": false },
    "foldabilityEstablished": { "const": false },
    "supportProfileIncluded": { "const": false },
    "toleranceProfileIncluded": { "const": false },
    "scientificVerificationClaimed": { "const": false },
    "globalM0fGate": { "const": "not-evaluated" },
    "caseCount": { "const": 1 },
    "artifactCount": { "const": 3 },
    "generator": {
      "const": {
        "generatorId": "oridesign-neg-path-polynomial-degree-range-candidate-bundle",
        "generatorVersion": "1.0.0-candidate",
        "serialization": "stable-json-utf8-lf-v1",
        "detector": "parseArtifactContractV1",
        "detectorSourcePath": "m0f/artifacts/contract.ts"
      }
    },
    "provenance": {
      "const": {
        "sourceReferenceId": "oridesign-neg-path-polynomial-degree-range-candidate-v1",
        "sourceKind": "project-authored",
        "title": "NEG-PATH-MUTATION-POLYNOMIAL-DEGREE-OUT-OF-RANGE project-authored piecewise-polynomial zero-degree rejection parser vector",
        "authors": ["OriDesign contributors"],
        "redistribution": "allowed",
        "licenseSpdx": "MIT"
      }
    },
    "cases": {
      "type": "array",
      "minItems": 1,
      "maxItems": 1,
      "prefixItems": [
        {
          "const": {
            "caseIndex": 0,
            "caseId": "NEG-PATH-MUTATION-POLYNOMIAL-DEGREE-OUT-OF-RANGE",
            "controlArtifactId": "control-design",
            "mutationKind": "replace-first-polynomial-segment-degree-with-zero",
            "changedPaths": ["$.pathCandidate.segments[0].motion.degree"],
            "sourceArtifactId": "source-path-polynomial-degree-out-of-range",
            "sourcePath": "path-polynomial-degree-out-of-range.json",
            "expectedOutcome": "rejected",
            "expectedIssues": [
              {
                "path": "$.pathCandidate.segments[0].motion.degree",
                "code": "out-of-range"
              }
            ]
          }
        }
      ],
      "items": false
    },
    "artifacts": {
      "type": "array",
      "minItems": 3,
      "maxItems": 3,
      "prefixItems": [
        { "$ref": "#/$defs/readmeArtifact" },
        { "$ref": "#/$defs/controlArtifact" },
        { "$ref": "#/$defs/sourceArtifact" }
      ],
      "items": false
    }
  },
  "$defs": {
    "artifactBase": {
      "type": "object",
      "additionalProperties": false,
      "required": [
        "artifactId",
        "role",
        "path",
        "mediaType",
        "sha256",
        "licenseSpdx",
        "provenance"
      ],
      "properties": {
        "artifactId": {},
        "role": {},
        "path": {},
        "mediaType": {},
        "sha256": {},
        "licenseSpdx": {},
        "provenance": {}
      }
    },
    "readmeArtifact": {
      "allOf": [
        { "$ref": "#/$defs/artifactBase" },
        {
          "type": "object",
          "properties": {
            "artifactId": { "const": "bundle-readme" },
            "role": { "const": "readme" },
            "path": { "const": "README.md" },
            "mediaType": { "const": "text/markdown; charset=utf-8" },
            "sha256": { "type": "string", "pattern": "^sha256:[0-9a-f]{64}$" },
            "licenseSpdx": { "const": "MIT" },
            "provenance": {
              "const": {
                "sourceReferenceId": "oridesign-neg-path-polynomial-degree-range-candidate-v1",
                "sourceUse": "project-authored",
                "derivation": "authored",
                "dependsOnArtifactIds": []
              }
            }
          }
        }
      ]
    },
    "controlArtifact": {
      "allOf": [
        { "$ref": "#/$defs/artifactBase" },
        {
          "type": "object",
          "properties": {
            "artifactId": { "const": "control-design" },
            "role": { "const": "accepted-control" },
            "path": { "const": "control-design.json" },
            "mediaType": { "const": "application/json" },
            "sha256": { "type": "string", "pattern": "^sha256:[0-9a-f]{64}$" },
            "licenseSpdx": { "const": "MIT" },
            "provenance": {
              "const": {
                "sourceReferenceId": "oridesign-neg-path-polynomial-degree-range-candidate-v1",
                "sourceUse": "project-authored",
                "derivation": "authored",
                "dependsOnArtifactIds": []
              }
            }
          }
        }
      ]
    },
    "sourceArtifact": {
      "allOf": [
        { "$ref": "#/$defs/artifactBase" },
        {
          "type": "object",
          "properties": {
            "artifactId": { "const": "source-path-polynomial-degree-out-of-range" },
            "role": { "const": "negative-source" },
            "path": { "const": "path-polynomial-degree-out-of-range.json" },
            "mediaType": { "const": "application/json" },
            "sha256": { "type": "string", "pattern": "^sha256:[0-9a-f]{64}$" },
            "licenseSpdx": { "const": "MIT" },
            "provenance": {
              "const": {
                "sourceReferenceId": "oridesign-neg-path-polynomial-degree-range-candidate-v1",
                "sourceUse": "project-authored",
                "derivation": "mutated-from-control",
                "dependsOnArtifactIds": ["control-design"]
              }
            }
          }
        }
      ]
    }
  }
}
