{"artifactCount":3,"artifacts":[{"artifactId":"bundle-readme","licenseSpdx":"MIT","mediaType":"text/markdown; charset=utf-8","path":"README.md","provenance":{"dependsOnArtifactIds":[],"derivation":"authored","sourceReferenceId":"oridesign-neg-path-polynomial-degree-range-candidate-v1","sourceUse":"project-authored"},"role":"readme","sha256":"sha256:f45e52c0e5ce18b9f5a76bf983fef160a401a8bf71188f39eecc729f27f6d800"},{"artifactId":"control-design","licenseSpdx":"MIT","mediaType":"application/json","path":"control-design.json","provenance":{"dependsOnArtifactIds":[],"derivation":"authored","sourceReferenceId":"oridesign-neg-path-polynomial-degree-range-candidate-v1","sourceUse":"project-authored"},"role":"accepted-control","sha256":"sha256:43b8311ee88de91a1c331d1737cfb7d734e7314cab6670feefe046fd15d66182"},{"artifactId":"source-path-polynomial-degree-out-of-range","licenseSpdx":"MIT","mediaType":"application/json","path":"path-polynomial-degree-out-of-range.json","provenance":{"dependsOnArtifactIds":["control-design"],"derivation":"mutated-from-control","sourceReferenceId":"oridesign-neg-path-polynomial-degree-range-candidate-v1","sourceUse":"project-authored"},"role":"negative-source","sha256":"sha256:b3c11559effa16a903016f9e4d8913dc63e5bb5808112273e6c0e9eefa2162b7"}],"canonicalManifestPath":"tests/fixtures/manifest.json","canonicalManifestRegistration":"not-registered","canonicalPathMutationFamilyComplete":false,"canonicalPromotionClaimed":false,"caseCount":1,"cases":[{"caseId":"NEG-PATH-MUTATION-POLYNOMIAL-DEGREE-OUT-OF-RANGE","caseIndex":0,"changedPaths":["$.pathCandidate.segments[0].motion.degree"],"controlArtifactId":"control-design","expectedIssues":[{"code":"out-of-range","path":"$.pathCandidate.segments[0].motion.degree"}],"expectedOutcome":"rejected","mutationKind":"replace-first-polynomial-segment-degree-with-zero","sourceArtifactId":"source-path-polynomial-degree-out-of-range","sourcePath":"path-polynomial-degree-out-of-range.json"}],"certificateHashVerificationIncluded":false,"collisionDetectionIncluded":false,"collisionFreedomEstablished":false,"conservativeDerivativeBoundsEstablished":false,"contactAnalysisIncluded":false,"continuousCollisionDetectionIncluded":false,"contractStatus":"candidate","creaseMapCompletenessEstablished":false,"cryptographicAuthenticityEstablished":false,"declaredPiecewisePolynomialCoefficientDegreeCardinalityParserOnly":false,"declaredPiecewisePolynomialZeroDegreeRejectionParserOnly":true,"endpointContinuityEstablished":false,"faceIsometryEstablished":false,"foldabilityEstablished":false,"fractionalDegreeRejectionVectorIncluded":false,"generalPositiveSafeIntegerDegreeDomainEstablished":false,"generator":{"detector":"parseArtifactContractV1","detectorSourcePath":"m0f/artifacts/contract.ts","generatorId":"oridesign-neg-path-polynomial-degree-range-candidate-bundle","generatorVersion":"1.0.0-candidate","serialization":"stable-json-utf8-lf-v1"},"globalM0fGate":"not-evaluated","hingeGeometryEstablished":false,"kinematicFeasibilityEstablished":false,"motionMapCompletenessEstablished":false,"pathRepresentationCompletenessEstablished":false,"pathTimeCoverageEstablished":false,"physicalAngleBoundsEstablished":false,"physicalAngleScheduleEstablished":false,"physicalPathContinuityEstablished":false,"piecewisePolynomialBasisFrozen":false,"piecewisePolynomialEndpointInferenceIncluded":false,"polynomialCoefficientIntervalAssociationEstablished":false,"polynomialCoefficientOrderingEstablished":false,"polynomialCoefficientSemanticsEstablished":false,"polynomialDerivativeSemanticsEstablished":false,"polynomialDerivativeValidationIncluded":false,"provenance":{"authors":["OriDesign contributors"],"licenseSpdx":"MIT","redistribution":"allowed","sourceKind":"project-authored","sourceReferenceId":"oridesign-neg-path-polynomial-degree-range-candidate-v1","title":"NEG-PATH-MUTATION-POLYNOMIAL-DEGREE-OUT-OF-RANGE project-authored piecewise-polynomial zero-degree rejection parser vector"},"radianConventionEstablished":false,"recordType":"m0f-neg-path-polynomial-degree-range-candidate-bundle-ledger","representationSelectionEstablished":false,"rigidityEstablished":false,"schemaId":"https://oridesign.local/schemas/m0f/neg-path-polynomial-degree-range-candidate-bundle-ledger-v1.schema.json","schemaVersion":1,"scientificClaim":false,"scientificVerificationClaimed":false,"scope":"project-authored-exact-negative-artifact-contract-piecewise-polynomial-zero-degree-rejection-parser-replay-only","supportProfileIncluded":false,"toleranceProfileIncluded":false,"unsafeIntegerDegreeRejectionVectorIncluded":false,"vectorSetId":"NEG-PATH-MUTATION-POLYNOMIAL-DEGREE-OUT-OF-RANGE-V1"}
